{
  "format": "whocue_event_handoff",
  "format_version": "1.0",
  "generated_at": "2026-09-18T21:15:00.000Z",
  "purpose": "External handoff of current WhoCue event state for user-controlled follow-up processing.",
  "not_a_whocue_import_file": true,
  "suggested_file_name": "whocue-harbor-city-founders-mixer-2026-handoff-2026-09-18T21-15-00.000Z.json",
  "instructions": {
    "privacy": "This export contains private local event/person data. Treat it as user-provided private context.",
    "use": "Use this file to summarize meetings, draft follow-up plans, or prepare system-specific updates only after the user chooses the downstream workflow.",
    "import_note": "The import_compatible_snapshot section can inform a future WhoCue import file, but this whole handoff document is not accepted by the WhoCue import schema."
  },
  "summary": {
    "event_name": "Harbor City Founders Mixer 2026",
    "people_count": 3,
    "met_count": 2,
    "not_met_count": 1,
    "followup_me_count": 3,
    "followup_other_count": 1
  },
  "import_compatible_snapshot": {
    "schema_version": "1.0",
    "event": {
      "name": "Harbor City Founders Mixer 2026",
      "source_id": "event-hcfm-2026",
      "start_at": "2026-09-18T22:00:00.000Z",
      "end_at": "2026-09-19T01:30:00.000Z",
      "timezone": "America/New_York",
      "location": "Harbor City Maker Hall",
      "description": "Synthetic sample event used to validate a practical WhoCue handoff export."
    },
    "people": [
      {
        "name": "Dana Whitfield",
        "source_id": "person-dana-whitfield",
        "title": "Head of Partnerships",
        "company": "Lantern Grid Demo Co",
        "notes": "Runs the partner program that keeps coming up in founder conversations.",
        "email": "dana.whitfield@example.invalid",
        "connection_topic": "Compare how small teams decide which partnerships are worth the integration cost.",
        "priority": "high",
        "status": "met",
        "tags": [
          "partnerships",
          "speaker"
        ],
        "links": {
          "linkedin": "https://example.com/in/dana-whitfield",
          "website": "https://example.com/people/dana-whitfield"
        }
      },
      {
        "name": "Marisol Vega",
        "source_id": "person-marisol-vega",
        "title": "Founder",
        "company": "Quiet Harbor Analytics",
        "notes": "Second-time founder; previous company was acquired by a synthetic analytics vendor.",
        "phone": "+1-555-0148",
        "connection_topic": "Ask how they staged their first analytics hire before product-market fit.",
        "priority": "medium",
        "status": "met",
        "tags": [
          "analytics",
          "founder"
        ],
        "links": {
          "blog": "https://example.com/blog/marisol-vega"
        }
      },
      {
        "name": "Theo Brandt",
        "source_id": "person-theo-brandt",
        "title": "Principal Engineer",
        "company": "Copperline Demo Labs",
        "notes": "Two people with this name spoke at synthetic conferences last year; confirm before opening with specifics.",
        "connection_topic": "Trade notes on offline-first mobile storage.",
        "identity_uncertain": true,
        "priority": "low",
        "status": "not_met",
        "tags": [
          "engineering",
          "mobile"
        ]
      }
    ]
  },
  "who_cue_state": {
    "event": {
      "local_id": "3f2a5c18-9d41-4f0b-8f77-2c6a1b9e4d02",
      "name": "Harbor City Founders Mixer 2026",
      "created_at": "2026-09-02T14:05:11.000Z",
      "updated_at": "2026-09-18T20:44:03.000Z",
      "source_id": "event-hcfm-2026",
      "start_at": "2026-09-18T22:00:00.000Z",
      "end_at": "2026-09-19T01:30:00.000Z",
      "timezone": "America/New_York",
      "location": "Harbor City Maker Hall",
      "description": "Synthetic sample event used to validate a practical WhoCue handoff export."
    },
    "people": [
      {
        "local_id": "6c0d7b93-1e52-4a8c-b0d6-5f19a3c74e18",
        "name": "Dana Whitfield",
        "status": "met",
        "identity_uncertain": false,
        "followups": {
          "email": "me",
          "call": "off",
          "schedule_meeting": "me",
          "send_documents": "off",
          "introduce": "off",
          "resume": "off"
        },
        "created_at": "2026-09-02T14:06:40.000Z",
        "updated_at": "2026-09-18T20:41:55.000Z",
        "source_id": "person-dana-whitfield",
        "title": "Head of Partnerships",
        "company": "Lantern Grid Demo Co",
        "notes": "Runs the partner program that keeps coming up in founder conversations.",
        "meeting_notes": "Walked through their partner review cadence. Wants the one-page integration summary by Friday.",
        "email": "dana.whitfield@example.invalid",
        "connection_topic": "Compare how small teams decide which partnerships are worth the integration cost.",
        "priority": "high",
        "tags": [
          "partnerships",
          "speaker"
        ],
        "links": {
          "linkedin": "https://example.com/in/dana-whitfield",
          "website": "https://example.com/people/dana-whitfield"
        }
      },
      {
        "local_id": "a71f4e60-58b3-4d29-9c7a-0e2d6b815f34",
        "name": "Marisol Vega",
        "status": "met",
        "identity_uncertain": false,
        "followups": {
          "email": "off",
          "call": "off",
          "schedule_meeting": "off",
          "send_documents": "me",
          "introduce": "other",
          "resume": "off"
        },
        "created_at": "2026-09-02T14:07:12.000Z",
        "updated_at": "2026-09-18T20:43:27.000Z",
        "source_id": "person-marisol-vega",
        "title": "Founder",
        "company": "Quiet Harbor Analytics",
        "notes": "Second-time founder; previous company was acquired by a synthetic analytics vendor.",
        "meeting_notes": "Offered to introduce me to their former head of data. Sending the hiring-plan template first.",
        "phone": "+1-555-0148",
        "connection_topic": "Ask how they staged their first analytics hire before product-market fit.",
        "priority": "medium",
        "tags": [
          "analytics",
          "founder"
        ],
        "links": {
          "blog": "https://example.com/blog/marisol-vega"
        }
      },
      {
        "local_id": "d94b2c07-3a6f-4e15-8b82-71c5d0a9e6b3",
        "name": "Theo Brandt",
        "status": "not_met",
        "identity_uncertain": true,
        "followups": {
          "email": "off",
          "call": "off",
          "schedule_meeting": "off",
          "send_documents": "off",
          "introduce": "off",
          "resume": "off"
        },
        "created_at": "2026-09-02T14:07:48.000Z",
        "updated_at": "2026-09-02T14:07:48.000Z",
        "source_id": "person-theo-brandt",
        "title": "Principal Engineer",
        "company": "Copperline Demo Labs",
        "notes": "Two people with this name spoke at synthetic conferences last year; confirm before opening with specifics.",
        "connection_topic": "Trade notes on offline-first mobile storage.",
        "priority": "low",
        "tags": [
          "engineering",
          "mobile"
        ]
      }
    ]
  }
}
