{
  "format": "whocue_event_handoff",
  "format_version": "1.0",
  "generated_at": "2026-09-19T00:42:00.000Z",
  "purpose": "External handoff of current WhoCue event state for user-controlled follow-up processing.",
  "not_a_whocue_import_file": true,
  "suggested_file_name": "whocue-civic-tech-expo-handoff-2026-09-19T00-42-00.000Z.json",
  "instructions": {
    "privacy": "This export contains private local event/person data. Treat it as user-provided private context.",
    "use": "Use this file to summarize meetings, draft follow-up plans, or prepare system-specific updates only after the user chooses the downstream workflow.",
    "import_note": "The import_compatible_snapshot section can inform a future WhoCue import file, but this whole handoff document is not accepted by the WhoCue import schema."
  },
  "summary": {
    "event_name": "Civic Tech Expo Demo Day",
    "people_count": 2,
    "met_count": 2,
    "not_met_count": 0,
    "followup_me_count": 1,
    "followup_other_count": 0
  },
  "import_compatible_snapshot": {
    "schema_version": "1.0",
    "event": {
      "name": "Civic Tech Expo Demo Day",
      "source_id": "event-cte-demo-day",
      "start_at": "2026-09-18T13:00:00.000Z",
      "timezone": "America/Chicago"
    },
    "people": [
      {
        "name": "Ines Okonkwo",
        "source_id": "person-ines-okonkwo",
        "title": "Program Director",
        "company": "Riverbend Civic Demo Trust",
        "connection_topic": "Ask which volunteer-coordination tools their grantees actually keep using.",
        "priority": "high",
        "status": "met",
        "tags": [
          "civic",
          "programs"
        ]
      },
      {
        "name": "Ravi Mehta",
        "title": "Staff Designer",
        "company": "Southline Demo Studio",
        "notes": "Met at the accessibility roundtable; was not on the imported list.",
        "connection_topic": "Follow up on the plain-language form patterns they walked through.",
        "priority": "medium",
        "status": "met",
        "tags": [
          "accessibility",
          "design"
        ]
      }
    ]
  },
  "who_cue_state": {
    "event": {
      "local_id": "b41d0f27-5c93-4e86-a7f2-30d8b6194ce0",
      "name": "Civic Tech Expo Demo Day",
      "created_at": "2026-09-10T16:02:31.000Z",
      "updated_at": "2026-09-18T23:55:12.000Z",
      "source_id": "event-cte-demo-day",
      "start_at": "2026-09-18T13:00:00.000Z",
      "timezone": "America/Chicago"
    },
    "people": [
      {
        "local_id": "7ae3c521-08bf-4d67-9c14-2b5e0a7f3d96",
        "name": "Ines Okonkwo",
        "status": "met",
        "identity_uncertain": false,
        "followups": {
          "email": "me",
          "call": "off",
          "schedule_meeting": "off",
          "send_documents": "off",
          "introduce": "off",
          "resume": "off"
        },
        "created_at": "2026-09-10T16:02:31.000Z",
        "updated_at": "2026-09-18T23:41:08.000Z",
        "source_id": "person-ines-okonkwo",
        "title": "Program Director",
        "company": "Riverbend Civic Demo Trust",
        "meeting_notes": "Grant cycle opens in November. Send the one-page summary before their board meeting.",
        "connection_topic": "Ask which volunteer-coordination tools their grantees actually keep using.",
        "priority": "high",
        "tags": [
          "civic",
          "programs"
        ]
      },
      {
        "local_id": "f08b6d94-2a71-4c35-b6e9-84c07f251a3d",
        "name": "Ravi Mehta",
        "status": "met",
        "identity_uncertain": false,
        "followups": {
          "email": "off",
          "call": "off",
          "schedule_meeting": "off",
          "send_documents": "off",
          "introduce": "off",
          "resume": "off"
        },
        "created_at": "2026-09-18T23:12:44.000Z",
        "updated_at": "2026-09-18T23:55:12.000Z",
        "notes": "Met at the accessibility roundtable; was not on the imported list.",
        "title": "Staff Designer",
        "company": "Southline Demo Studio",
        "meeting_notes": "Added in the app during the roundtable. Wants the plain-language form checklist.",
        "connection_topic": "Follow up on the plain-language form patterns they walked through.",
        "priority": "medium",
        "tags": [
          "accessibility",
          "design"
        ]
      }
    ]
  }
}
