{
  "format": "whocue_event_handoff",
  "format_version": "1.0",
  "generated_at": "2026-09-19T02:00:00.000Z",
  "purpose": "External handoff of current WhoCue event state for user-controlled follow-up processing.",
  "not_a_whocue_import_file": true,
  "suggested_file_name": "whocue-empty-demo-event-handoff-2026-09-19T02-00-00.000Z.json",
  "instructions": {
    "privacy": "This export contains private local event/person data. Treat it as user-provided private context.",
    "use": "Use this file to summarize meetings, draft follow-up plans, or prepare system-specific updates only after the user chooses the downstream workflow.",
    "import_note": "The import_compatible_snapshot section can inform a future WhoCue import file, but this whole handoff document is not accepted by the WhoCue import schema."
  },
  "summary": {
    "event_name": "Empty Demo Event",
    "people_count": 0,
    "met_count": 0,
    "not_met_count": 0,
    "followup_me_count": 0,
    "followup_other_count": 0
  },
  "import_compatible_snapshot": {
    "schema_version": "1.0",
    "event": {
      "name": "Empty Demo Event"
    },
    "people": []
  },
  "who_cue_state": {
    "event": {
      "local_id": "5d7c2e81-4a09-4b63-8e15-9f02d6a37c48",
      "name": "Empty Demo Event",
      "created_at": "2026-09-19T01:58:02.000Z",
      "updated_at": "2026-09-19T01:58:02.000Z"
    },
    "people": []
  }
}
